Severity 1-day,Severity 2-day,Severity 3-day,Severity 4-day,Severity 5-day,Severity 6-day,Severity 7-day,Total Deaths Hospital,Hospital Name,CMS Certification Number,countyFIPS,CountyName,StateName,System Affiliation
1,1,2,2,2,2,2,0,Southeast Georgia Health System - Camden Campus,110146,13039,Camden,Georgia,"Southeast Georgia Health System - Brunswick, GA"
1,1,2,2,2,2,2,0,Greene County General Hospital,151317,18055,Greene,Indiana,"Not In Any System - ,"
1,1,2,2,2,2,2,0,Indiana University Health Frankfort Hospital,151316,18023,Clinton,Indiana,"Indiana University Health - Indianapolis, IN"
1,1,2,2,2,2,2,0,Sampson Regional Medical Center,340024,37163,Sampson,North Carolina,"Not In Any System - ,"
1,1,2,2,2,2,2,0,Evans Memorial Hospital,110142,13109,Evans,Georgia,"Not In Any System - ,"
1,1,2,2,2,2,2,0,Essentia Health - Ada Hospital,241313,27107,Norman,Minnesota,"Essentia Health - Duluth, MN"
1,1,2,2,2,2,2,0,Northridge Medical Center,110040,13157,Jackson,Georgia,"Not In Any System - ,"
1,1,2,2,2,2,2,0,Broaddus Hospital,511300,54001,Barbour,West Virginia,"Davis Health System - Elkins, WV"
1,1,2,2,2,2,2,0,Washakie Medical Center,531306,56043,Washakie,Wyoming,"Banner Health - Phoenix, AZ"
1,1,2,2,2,2,2,0,TriStar Ashland City,441311,47021,Cheatham,Tennessee,"HCA Healthcare - Nashville, TN"
1,1,2,2,2,2,2,0,Madison County Memorial Hospital,161326,19121,Madison,Iowa,"Not In Any System - ,"
1,1,2,2,2,2,2,0,Davis Medical Center,510030,54083,Randolph,West Virginia,"Davis Health System - Elkins, WV"
1,1,2,2,2,2,2,0,RC Hospital And Clinics - Olivia,241306,27129,Renville,Minnesota,"Not In Any System - ,"
1,1,2,2,2,2,2,0,Henry County Hospital,361309,39069,Henry,Ohio,"Not In Any System - ,"
1,1,2,2,2,2,2,0,Memorial Hospital and Health Care Center,150115,18037,Dubois,Indiana,"Not In Any System - ,"
1,1,2,2,2,2,2,0,Nell J. Redfield Memorial Hospital,131303,16071,Oneida,Idaho,"Not In Any System - ,"
1,1,2,2,2,2,2,0,Trigg County Hospital,181304,21221,Trigg,Kentucky,"Not In Any System - ,"
1,1,2,2,2,2,2,0,Memorial Hospital and Manor,110132,13087,Decatur,Georgia,"Not In Any System - ,"
1,1,2,2,2,2,2,0,Virginia Gay Hospital,161349,19011,Benton,Iowa,"Not In Any System - ,"
1,1,2,2,2,2,2,0,Regional Medical Center,161343,19055,Delaware,Iowa,"Not In Any System - ,"
1,1,2,2,2,2,2,0,Lost Rivers Medical Center,131324,16023,Butte,Idaho,"Not In Any System - ,"
1,1,2,2,2,2,2,0,Horn Memorial Hospital,161354,19093,Ida,Iowa,"Not In Any System - ,"
1,1,2,2,2,2,2,0,Webster County Memorial Hospital,511301,54101,Webster,West Virginia,"Not In Any System - ,"
1,1,2,2,2,2,2,0,Ephraim McDowell James B. Haggin Hospital,181302,21167,Mercer,Kentucky,"Ephraim McDowell Health - Danville, KY"
1,1,2,2,2,2,2,0,North Shore Health,241317,27031,Cook,Minnesota,"Not In Any System - ,"
1,1,2,2,2,2,2,0,Crosbyton Clinic Hospital,451345,48107,Crosby,Texas,"Not In Any System - ,"
1,1,2,2,2,2,2,0,Ascension St. Vincent Salem,151314,18175,Washington,Indiana,"Ascension Health - Saint Louis, MO"
1,1,2,2,2,2,2,0,Wood County Hospital,360029,39173,Wood,Ohio,"Not In Any System - ,"
1,1,2,2,2,2,2,0,South Lyon Medical Center,291314,32019,Lyon,Nevada,"Not In Any System - ,"
1,1,2,2,2,2,2,0,Geisinger Lewistown Hospital,390048,42087,Mifflin,Pennsylvania,"Geisinger - Danville, PA"
1,1,2,2,2,2,2,0,Newark-Wayne Community Hospital,330030,36117,Wayne,New York,"Rochester Regional Health System - Rochester, NY"
1,1,2,2,2,2,2,0,FHN Memorial Hospital,140160,17177,Stephenson,Illinois,"Not In Any System - ,"
1,1,2,2,2,2,2,0,Marcus Daly Memorial Hospital,271340,30081,Ravalli,Montana,"Not In Any System - ,"
1,1,2,2,2,2,2,0,Cochran Memorial Hospital,451366,48079,Cochran,Texas,"Not In Any System - ,"
1,1,2,2,2,2,2,0,MidMichigan Medical Center - Midland,230222,26111,Midland,Michigan,"MidMichigan Health - Midland, MI"
1,1,2,2,2,2,2,0,Pershing General Hospital,291304,32027,Pershing,Nevada,"Not In Any System - ,"
1,1,2,2,2,2,2,0,Cass Lake Hospital,241358,27021,Cass,Minnesota,"Indian Health Service - Rockville, MD"
1,1,2,2,2,2,2,0,Mary Rutan Hospital,360197,39091,Logan,Ohio,"Not In Any System - ,"
1,1,2,2,2,2,2,0,Cameron Regional Medical Center,260057,29049,Clinton,Missouri,"Not In Any System - ,"
1,1,2,2,2,2,2,0,Genesis Hospital,360039,39119,Muskingum,Ohio,"Not In Any System - ,"
1,1,2,2,2,2,3,0,Permian Regional Medical Center,450144,48003,Andrews,Texas,"Not In Any System - ,"
1,1,2,2,2,2,3,0,CHI Saint Joseph Health Mount Sterling,180064,21173,Montgomery,Kentucky,"CommonSpirit Health - Englewood, CO"
1,1,2,2,2,2,3,0,Adena Pike Medical Center,361334,39131,Pike,Ohio,"Adena Health System - Chillicothe, OH"
1,1,2,2,2,2,3,0,Southwell Medical,110101,13075,Cook,Georgia,"Tift Regional Health System - Tifton, GA"
1,1,2,2,2,2,3,0,HSHS Saint Anthony's Memorial Hospital,140032,17049,Effingham,Illinois,"Hospital Sisters Health System (HSHS) - Springfield, IL"
1,1,2,2,2,2,3,0,Mimbres Memorial Hospital,321309,35029,Luna,New Mexico,"Quorum Health Corporation - Brentwood, TN"
1,1,2,2,2,2,3,0,Colusa Medical Center,50783,6011,Colusa,California,"Not In Any System - ,"
1,1,2,2,2,2,3,0,Caribou Memorial Hospital,131309,16029,Caribou,Idaho,"Not In Any System - ,"
1,1,2,2,2,2,3,0,Mayo Clinic Health System in Albert Lea,240043,27047,Freeborn,Minnesota,"Mayo Clinic Health System - Rochester, MN"
1,1,2,2,2,2,3,0,Memorial Hospital,370178,40001,Adair,Oklahoma,"Not In Any System - ,"
1,1,2,2,2,2,3,0,Sidney Regional Health Center,281357,31033,Cheyenne,Nebraska,"Not In Any System - ,"
1,1,2,2,2,2,3,0,OhioHealth Hardin Memorial Hospital,361315,39065,Hardin,Ohio,"OhioHealth - Columbus, OH"
1,1,2,2,2,2,3,0,Optim Medical Center Screven,111312,13251,Screven,Georgia,"Optim Healthcare - Savannah, GA"
1,1,2,2,2,2,3,0,Munson Healthcare Cadillac Hospital,230081,26165,Wexford,Michigan,"Munson Healthcare - Traverse City, MI"
1,1,2,2,2,2,3,0,Hiawatha Community Hospital,171341,20013,Brown,Kansas,"Not In Any System - ,"
1,1,2,2,2,2,2,0,Phelps Memorial Health Center,281362,31137,Phelps,Nebraska,"Not In Any System - ,"
1,1,2,2,2,2,3,0,Ascension Sacred Heart Hospital on the Gulf,100313,12045,Gulf,Florida,"Ascension Health - Saint Louis, MO"
1,1,2,2,2,2,3,0,Miners' Colfax Medical Center,321307,35007,Colfax,New Mexico,"Not In Any System - ,"
1,1,2,2,2,2,3,0,Mountainview Medical Center,271306,30059,Meagher,Montana,"Not In Any System - ,"
1,1,2,2,2,2,3,0,Helena Regional Medical Center,40085,5107,Phillips,Arkansas,"Quorum Health Corporation - Brentwood, TN"
1,1,2,2,2,2,3,0,Northeastern Vermont Regional Hospital,471303,50005,Caledonia,Vermont,"Not In Any System - ,"
1,1,2,2,2,2,3,0,TriStar Horizon Medical Center,440046,47043,Dickson,Tennessee,"HCA Healthcare - Nashville, TN"
1,1,2,2,2,2,3,0,Regional Health Services of Howard County,161328,19089,Howard,Iowa,"Not In Any System - ,"
1,1,2,2,2,2,3,0,Clinton Memorial Hospital,360175,39027,Clinton,Ohio,"LifePoint Health - Brentwood, TN"
1,1,2,2,2,2,3,0,Avera Queen of Peace Hospital,430013,46035,Davison,South Dakota,"Avera Health - Sioux Falls, SD"
1,1,2,2,2,2,3,0,Marshall County Healthcare Center Avera,431312,46091,Marshall,South Dakota,"Avera Health - Sioux Falls, SD"
1,1,2,2,2,2,3,0,LeConte Medical Center,440081,47155,Sevier,Tennessee,"Covenant Health - Knoxville, TN"
1,1,2,2,2,2,3,0,Boundary Community Hospital,131301,16021,Boundary,Idaho,"Not In Any System - ,"
1,1,2,2,2,2,3,0,Mason General Hospital,501336,53045,Mason,Washington,"Not In Any System - ,"
1,1,2,2,2,2,3,0,Jackson County Memorial Hospital,370022,40065,Jackson,Oklahoma,"Not In Any System - ,"
1,1,2,2,2,2,3,0,Ascension St. Vincent Jennings,151303,18079,Jennings,Indiana,"Ascension Health - Saint Louis, MO"
1,1,2,2,2,2,3,0,F.W. Huston Medical Center,171314,20087,Jefferson,Kansas,"Not In Any System - ,"
1,1,2,2,2,2,3,0,Cavalier County Memorial Hospital,351323,38019,Cavalier,North Dakota,"Not In Any System - ,"
1,1,2,2,2,2,3,0,Sutter Coast Hospital,50417,6015,Del Norte,California,"Sutter Health - Sacramento, CA"
1,1,2,2,2,2,3,0,CHI Oakes Community Hospital,351315,38021,Dickey,North Dakota,"CommonSpirit Health - Englewood, CO"
1,1,2,2,2,2,3,0,Saint Elizabeth Community Hospital,50042,6103,Tehama,California,"CommonSpirit Health - Englewood, CO"
1,1,2,2,2,2,3,0,Starr Regional Medical Center - Athens,440068,47107,McMinn,Tennessee,"LifePoint Health - Brentwood, TN"
1,1,2,2,2,2,3,0,Medical Center of South Arkansas,40088,5139,Union,Arkansas,"Community Health Systems, Inc. (CHS) - Franklin, TN"
1,1,2,2,2,2,3,0,Holy Rosary Healthcare,271347,30017,Custer,Montana,"SCL Health - Denver, CO"
1,1,2,2,2,2,3,0,Vidant Beaufort Hospital,340186,37013,Beaufort,North Carolina,"Vidant Health - Greenville, NC"
1,1,2,2,3,3,3,0,Cullman Regional Medical Center,10035,1043,Cullman,Alabama,"Not In Any System - ,"
1,1,2,2,2,2,3,0,Sanford Jackson Medical Center,241315,27063,Jackson,Minnesota,"Sanford Health - Fargo, Sioux Falls, ND"
1,1,2,2,2,2,3,0,UnityPoint Health - Marshalltown,160001,19127,Marshall,Iowa,"UnityPoint Health - Des Moines, IA"
1,1,2,2,2,2,3,0,Harrison County Community Hospital,261312,29081,Harrison,Missouri,"Not In Any System - ,"
1,1,2,2,2,2,3,0,Community Memorial Healthcare,171363,20117,Marshall,Kansas,"Not In Any System - ,"
1,1,2,2,2,2,3,0,Shands Live Oak Regional Medical Center,101301,12121,Suwannee,Florida,"Community Health Systems, Inc. (CHS) - Franklin, TN"
1,1,2,2,2,2,3,0,Brooks County Hospital,111332,13027,Brooks,Georgia,"Archbold Medical Center - Thomasville, GA"
1,1,2,2,2,2,3,0,Crook County Medical Services District,531311,56011,Crook,Wyoming,"Not In Any System - ,"
1,1,2,2,2,2,3,0,Dale Medical Center,10021,1045,Dale,Alabama,"Not In Any System - ,"
1,1,2,2,2,2,3,0,Porter Medical Center,471307,50001,Addison,Vermont,"Not In Any System - ,"
1,1,2,2,2,2,3,0,Glen Rose Medical Center,450451,48425,Somervell,Texas,"Not In Any System - ,"
1,1,2,2,2,2,3,0,Sevier Valley Hospital,460026,49041,Sevier,Utah,"Intermountain Health Care, Inc - Salt Lake City, UT"
1,1,2,2,2,2,3,0,Abbeville Area Medical Center,421301,45001,Abbeville,South Carolina,"Not In Any System - ,"
1,1,2,2,2,2,3,0,Waldo County General Hospital,201312,23027,Waldo,Maine,"MaineHealth - Portland, ME"
1,1,2,2,2,2,3,0,Fulton County Health Center,361333,39051,Fulton,Ohio,"Not In Any System - ,"
1,1,2,2,2,2,3,0,Transylvania Regional Hospital,341319,37175,Transylvania,North Carolina,"HCA Healthcare - Nashville, TN"
1,1,2,2,2,2,3,0,Pagosa Springs Medical Center,61328,8007,Archuleta,Colorado,"Not In Any System - ,"
1,1,2,2,2,2,3,0,North Country Hospital,471304,50019,Orleans,Vermont,"Not In Any System - ,"
1,1,2,2,2,2,3,0,Baptist Memorial Hospital - Golden Triangle,250100,28087,Lowndes,Mississippi,"Baptist Memorial Health Care Corporation - Memphis, TN"
1,1,2,2,2,2,2,0,Archbold Medical Center,110038,13275,Thomas,Georgia,"Archbold Medical Center - Thomasville, GA"
1,1,2,2,2,2,2,0,Compass Memorial Healthcare,161317,19095,Iowa,Iowa,"Not In Any System - ,"
1,1,2,2,2,2,2,0,Adena Regional Medical Center,360159,39141,Ross,Ohio,"Adena Health System - Chillicothe, OH"
1,1,2,2,2,2,2,0,Rooks County Health Center,171311,20163,Rooks,Kansas,"Not In Any System - ,"
1,1,2,2,2,2,2,0,Asante Three Rivers Medical Center,380002,41033,Josephine,Oregon,"Asante Health System - Medford, OR"
1,1,2,2,2,2,2,0,Berger Hospital,360170,39129,Pickaway,Ohio,"OhioHealth - Columbus, OH"
1,1,2,2,2,2,2,0,Mercy Health-Urbana,361312,39021,Champaign,Ohio,"Bon Secours Mercy Health - Cincinnati, OH"
1,1,2,2,2,2,2,0,Franciscan  Health  Crawfordsville,150022,18107,Montgomery,Indiana,"Franciscan Health - Mishawaka, IN"
1,1,2,2,2,2,2,0,Great River Medical Center,160057,19057,Des Moines,Iowa,"Not In Any System - ,"
1,1,2,2,2,2,2,0,Vidant Roanoke-Chowan Hospital,340099,37091,Hertford,North Carolina,"Vidant Health - Greenville, NC"
1,1,2,2,2,2,2,0,Mount San Rafael Hospital,61321,8071,Las Animas,Colorado,"Not In Any System - ,"
1,1,2,2,2,2,2,0,Mercy Hospital Logan County,371317,40083,Logan,Oklahoma,"Mercy - Chesterfield, MO"
1,1,2,2,2,2,2,0,Community Hospital,281363,31145,Red Willow,Nebraska,"Not In Any System - ,"
1,1,2,2,2,2,2,0,Sumner County Hospital,171329,20191,Sumner,Kansas,"Not In Any System - ,"
1,1,2,2,2,2,2,0,Advocate Eureka Hospital,141309,17203,Woodford,Illinois,"Advocate Aurora Health - Downers Grove, IL"
1,1,2,2,2,2,3,0,Deer Lodge Medical Center,271314,30077,Powell,Montana,"Not In Any System - ,"
1,1,2,2,2,2,2,0,Lincoln County Hospital,171360,20105,Lincoln,Kansas,"Not In Any System - ,"
1,1,2,2,2,2,2,0,Boone Memorial Hospital,511313,54005,Boone,West Virginia,"Not In Any System - ,"
1,1,2,2,2,2,2,0,Sparrow Ionia Hospital,231331,26067,Ionia,Michigan,"Sparrow Health System - Lansing, MI"
1,1,2,2,2,2,2,0,Houston County Community Hospital,441322,47083,Houston,Tennessee,"Not In Any System - ,"
1,1,2,2,2,2,2,0,Hocking Valley Community Hospital,361330,39073,Hocking,Ohio,"Not In Any System - ,"
1,1,2,2,2,2,2,0,Missouri Delta Medical Center,260113,29201,Scott,Missouri,"Not In Any System - ,"
1,1,2,2,2,2,2,0,Potomac Valley Hospital,511315,54057,Mineral,West Virginia,"West Virginia University Medicine - Morgantown, WV"
1,1,2,2,2,2,2,0,Yoakum County Hospital,451308,48501,Yoakum,Texas,"Not In Any System - ,"
1,1,2,2,2,2,2,0,Jones Regional Medical Center,161306,19105,Jones,Iowa,"UnityPoint Health - Des Moines, IA"
1,1,2,2,2,2,2,0,Rio Grande Hospital,61301,8105,Rio Grande,Colorado,"Not In Any System - ,"
1,1,2,2,2,2,2,0,Dunes Surgery Hospital,430089,46127,Union,South Dakota,"Not In Any System - ,"
1,1,2,2,2,2,2,0,Rice County District Hospital,171330,20159,Rice,Kansas,"Not In Any System - ,"
1,1,2,2,2,2,2,0,Soldiers & Sailors Memorial Hospital,331314,36123,Yates,New York,"Finger Lakes Health - Geneva, NY"
1,1,2,2,2,2,2,0,Johnson Regional Medical Center,40002,5071,Johnson,Arkansas,"Not In Any System - ,"
1,1,2,2,2,2,2,0,Riverside Walter Reed Hospital,490130,51073,Gloucester,Virginia,"Riverside Health System - Newport News, VA"
1,1,2,2,2,2,2,0,AdventHealth Rollins Brook,451323,48281,Lampasas,Texas,"AdventHealth - Altamonte Springs, FL"
1,1,2,2,2,2,2,0,Adventist Health and Rideout,50133,6115,Yuba,California,"Not In Any System - ,"
1,1,2,2,2,2,3,0,Floyd County Medical Center,161347,19067,Floyd,Iowa,"Not In Any System - ,"
1,1,2,2,2,2,2,0,Memorial Hospital,281320,31081,Hamilton,Nebraska,"Not In Any System - ,"
1,1,2,2,2,2,2,0,The Outer Banks Hospital,341324,37055,Dare,North Carolina,"Not In Any System - ,"
1,1,2,2,2,2,3,0,Share Medical Center,371341,40151,Woods,Oklahoma,"Not In Any System - ,"
1,1,2,2,2,2,3,0,Wyandot Memorial Hospital,361329,39175,Wyandot,Ohio,"Not In Any System - ,"
1,1,2,2,2,2,2,0,Clay County Medical Center,171371,20027,Clay,Kansas,"Not In Any System - ,"
1,1,2,2,2,2,3,0,SGMC Lanier Campus,111326,13173,Lanier,Georgia,"South Georgia Health System - Valdosta, GA"
1,1,2,2,2,2,3,0,Preston Memorial Hospital,511312,54077,Preston,West Virginia,"Mon Health System - Morgantown, WV"
1,1,2,2,2,2,3,0,Allendale County Hospital,421300,45005,Allendale,South Carolina,"Not In Any System - ,"
1,1,2,2,2,2,3,0,Sistersville General Hospital,511304,54095,Tyler,West Virginia,"Not In Any System - ,"
1,1,2,2,2,2,2,0,Sakakawea Medical Center,351310,38057,Mercer,North Dakota,"Not In Any System - ,"
1,1,2,2,2,2,2,0,Fort Loudoun Medical Center,440110,47105,Loudon,Tennessee,"Covenant Health - Knoxville, TN"
1,1,2,2,2,2,2,0,CHI St. Joseph Health Madison Hospital,451316,48313,Madison,Texas,"CommonSpirit Health - Englewood, CO"
1,1,2,2,2,2,2,0,Adventist Health Tillamook Regional Medical Center,381317,41057,Tillamook,Oregon,"Adventist Health - Roseville, CA"
1,1,2,2,2,2,2,0,Harney District Hospital,381307,41025,Harney,Oregon,"Not In Any System - ,"
1,1,2,2,2,2,2,0,Butler County Health Care Center,281332,31023,Butler,Nebraska,"Not In Any System - ,"
1,1,2,2,2,2,2,0,Illini Community Hospital,141315,17149,Pike,Illinois,"Blessing Health System - Quincy, IL"
1,1,2,2,2,2,3,0,Baptist Memorial Hospital - Tipton,440131,47167,Tipton,Tennessee,"Baptist Memorial Health Care Corporation - Memphis, TN"
1,1,2,2,2,2,2,0,Sky Lakes Medical Center,380050,41035,Klamath,Oregon,"Not In Any System - ,"
1,1,2,2,2,2,2,0,Crisp Regional Hospital,110104,13081,Crisp,Georgia,"Not In Any System - ,"
1,1,2,2,2,2,2,0,Benefis Teton Medical Center,271307,30099,Teton,Montana,"Benefis Healthcare - Great Falls, MT"
1,1,2,2,2,2,2,0,NorthCrest Medical Center,440065,47147,Robertson,Tennessee,"Not In Any System - ,"
1,1,2,2,2,2,2,0,Frio Regional Hospital,451391,48163,Frio,Texas,"Not In Any System - ,"
1,1,2,2,2,2,2,0,St. Thomas More Hospital,61344,8043,Fremont,Colorado,"Centura Health - Englewood, CO"
1,1,2,2,3,3,3,0,Wabash General Hospital,141327,17185,Wabash,Illinois,"Not In Any System - ,"
1,1,2,2,3,3,3,0,MUSC Health Chester Medical Center,420019,45023,Chester,South Carolina,"Medical University of South Carolina - Charleston, SC"
1,1,2,2,3,3,3,0,Rutland Regional Medical Center,470005,50021,Rutland,Vermont,"Not In Any System - ,"
1,1,2,3,3,3,3,0,CHRISTUS Jasper Memorial Hospital,450573,48241,Jasper,Texas,"CHRISTUS Health - Irving, TX"
1,1,2,3,3,3,3,0,Decatur County Hospital,171352,20039,Decatur,Kansas,"Not In Any System - ,"
1,1,2,3,3,3,3,0,Cimarron Memorial Hospital,371307,40025,Cimarron,Oklahoma,"Not In Any System - ,"
1,1,2,3,3,3,3,0,White River Medical Center,40119,5063,Independence,Arkansas,"White River Health System - Mountain View, AR"
1,1,2,3,3,3,3,0,Monument Health Custer Hospital,431323,46033,Custer,South Dakota,"Monument Health - Rapid City, SD"
1,1,2,3,3,3,3,0,Ascension Jane Phillips Nowata Health Center,371305,40105,Nowata,Oklahoma,"Ascension Health - Saint Louis, MO"
1,1,2,3,3,3,3,0,Lakeland Community Hospital,10125,1133,Winston,Alabama,"Not In Any System - ,"
1,1,2,3,3,3,3,0,Smith County Memorial Hospital,171377,20183,Smith,Kansas,"Not In Any System - ,"
1,1,2,3,3,3,3,0,Wayne General Hospital,250077,28153,Wayne,Mississippi,"Not In Any System - ,"
1,1,2,3,3,3,3,0,Pampa Regional Medical Center,450099,48179,Gray,Texas,"Prime Healthcare Services, Inc. - Ontario, CA"
1,1,2,3,3,3,3,0,Riverside Shore Memorial Hospital,490037,51001,Accomack,Virginia,"Riverside Health System - Newport News, VA"
1,1,2,3,3,3,3,0,Gove County Medical Center,171367,20063,Gove,Kansas,"Not In Any System - ,"
1,1,2,3,3,3,3,0,Pemiscot Memorial Main Hospital,260070,29155,Pemiscot,Missouri,"Not In Any System - ,"
1,1,2,3,3,3,3,0,Jefferson Healthcare Medical Center,501323,53031,Jefferson,Washington,"Not In Any System - ,"
1,1,2,3,3,3,3,0,Cass County Memorial Hospital,161376,19029,Cass,Iowa,"Not In Any System - ,"
1,1,2,3,3,3,3,0,LewisGale Hospital - Pulaski,490116,51155,Pulaski,Virginia,"HCA Healthcare - Nashville, TN"
1,1,2,3,3,3,3,0,Ascension Eagle River Memorial Hospital,521300,55125,Vilas,Wisconsin,"Ascension Health - Saint Louis, MO"
1,1,2,3,3,3,3,0,McLaren Lapeer Region,230193,26087,Lapeer,Michigan,"McLaren Health Care - Flint, MI"
1,1,2,3,3,3,3,0,Regional West Garden County Hospital,281310,31069,Garden,Nebraska,"Not In Any System - ,"
1,1,2,3,3,3,3,0,Magruder Hospital,361314,39123,Ottawa,Ohio,"Not In Any System - ,"
1,1,2,3,3,3,3,0,Mountain Community Medical Services,51315,6105,Trinity,California,"Not In Any System - ,"
1,1,2,3,3,3,3,0,Haskell Memorial Hospital,451341,48207,Haskell,Texas,"Not In Any System - ,"
1,1,2,3,3,3,3,0,Palestine Regional Medical Center,450747,48001,Anderson,Texas,"LifePoint Health - Brentwood, TN"
1,1,2,3,3,3,3,0,Dahl Memorial Healthcare Association,271302,30011,Carter,Montana,"Not In Any System - ,"
1,1,2,3,3,3,3,0,Mary Breckinridge ARH Hospital,181316,21131,Leslie,Kentucky,"Appalachian Regional Healthcare - Lexington, KY"
1,1,2,3,3,3,3,0,Sedgwick County Health Center,61310,8115,Sedgwick,Colorado,"Not In Any System - ,"
1,1,2,3,3,3,3,0, Izard County Medical Center,41306,5065,Izard,Arkansas,"Americore Health - Fort Lauderdale, FL"
1,1,2,3,3,3,3,0,Pershing Memorial Hospital,261307,29115,Linn,Missouri,"Not In Any System - ,"
1,1,2,3,3,3,3,0,Fannin Regional Hospital,110189,13111,Fannin,Georgia,"Quorum Health Corporation - Brentwood, TN"
1,1,2,3,3,3,3,0,Little River Memorial Hospital,41320,5081,Little River,Arkansas,"Not In Any System - ,"
1,1,2,3,3,3,3,0,Burgess Health Center,161359,19133,Monona,Iowa,"Not In Any System - ,"
1,1,2,3,3,3,3,0,Lawrence Medical Center,10059,1079,Lawrence,Alabama,"Not In Any System - ,"
1,1,2,3,3,3,3,0,Avera Weskota Memorial Medical Center,431324,46073,Jerauld,South Dakota,"Avera Health - Sioux Falls, SD"
1,1,2,3,3,3,3,0,George Regional Hospital,250036,28039,George,Mississippi,"George Regional Health System - Lucedale, MS"
1,1,2,3,3,3,3,0,Lawrence County Hospital,251305,28077,Lawrence,Mississippi,"Southwest Health Systems - McComb, MS"
1,1,2,3,3,3,3,0,Union General Hospital,110051,13291,Union,Georgia,"Union General Hospitals Inc - Blairsville, GA"
1,1,2,3,3,3,3,0,Saint Aloisius Medical Center,351327,38103,Wells,North Dakota,"Sisters of Mary of the Presentation Health System - Fargo, ND"
1,1,2,3,3,3,3,0,Fayette County Memorial Hospital,361331,39047,Fayette,Ohio,"Not In Any System - ,"
1,1,2,3,3,3,3,0,Marshall County Hospital,181327,21157,Marshall,Kentucky,"Not In Any System - ,"
1,1,2,3,3,3,3,0, Unity Health - Harris Medical Center,40080,5067,Jackson,Arkansas,"Unity Health - Searcy, AR"
1,1,2,3,3,3,3,0,Copiah County Medical Center,251327,28029,Copiah,Mississippi,"Not In Any System - ,"
1,1,2,3,3,3,3,0,McLeod Health Dillon,420005,45033,Dillon,South Carolina,"McLeod Health - Florence, SC"
1,1,2,3,3,3,3,0,Cooperstown Medical Center,351306,38039,Griggs,North Dakota,"Not In Any System - ,"
1,1,2,3,3,3,3,0,Wayne Memorial Hospital,390125,42127,Wayne,Pennsylvania,"Not In Any System - ,"
1,1,2,3,3,3,3,0,Baptist Memorial Hospital - Calhoun,251331,28013,Calhoun,Mississippi,"Baptist Memorial Health Care Corporation - Memphis, TN"
1,1,2,3,3,3,3,0,Throckmorton County Memorial Hospital,451339,48447,Throckmorton,Texas,"Not In Any System - ,"
1,1,2,3,3,3,3,0,Vaughan Regional Medical Center,10118,1047,Dallas,Alabama,"LifePoint Health - Brentwood, TN"
1,1,2,3,3,3,3,0,MidMichigan Medical Center - Alpena,230036,26007,Alpena,Michigan,"MidMichigan Health - Midland, MI"
1,1,2,3,3,3,3,0,Patients Choice Medical Center of Smith County,250163,28129,Smith,Mississippi,"Not In Any System - ,"
1,1,2,3,3,3,3,0,Faith Community Hospital,450241,48237,Jack,Texas,"Not In Any System - ,"
1,1,2,3,3,3,3,0,Carroll County Memorial Hospital,261332,29033,Carroll,Missouri,"Not In Any System - ,"
1,1,2,3,3,3,3,0,Olean General Hospital,330103,36009,Cattaraugus,New York,"Kaleida Health - Buffalo, NY"
1,1,2,3,3,3,3,0,Nelson County Health System Hospital,351308,38063,Nelson,North Dakota,"Not In Any System - ,"
1,1,2,3,3,3,3,0,Lucas County Health Center,161341,19117,Lucas,Iowa,"Not In Any System - ,"
1,1,2,3,3,3,3,0,Wythe County Community Hospital,490111,51197,Wythe,Virginia,"LifePoint Health - Brentwood, TN"
1,1,2,3,3,3,3,0,Saint Vincent's Chilton,10173,1021,Chilton,Alabama,"Ascension Health - Saint Louis, MO"
1,1,2,3,3,3,3,0,Webster County Community Hospital,281316,31181,Webster,Nebraska,"Not In Any System - ,"
1,1,2,3,3,3,3,0,Polk Medical Center,111330,13233,Polk,Georgia,"Floyd Health System - Rome, GA"
1,1,2,3,3,3,3,0,Crenshaw Community Hospital,10008,1041,Crenshaw,Alabama,"Not In Any System - ,"
1,1,2,3,3,3,3,0,Doctors Memorial Hospital,101307,12059,Holmes,Florida,"Not In Any System - ,"
1,1,2,3,3,3,3,0,Hardin County General Hospital,141328,17069,Hardin,Illinois,"Not In Any System - ,"
1,1,2,3,3,3,3,0,Harlan County Health System,281300,31083,Harlan,Nebraska,"Not In Any System - ,"
1,1,2,3,3,3,3,0,Clearwater Valley Hospital,131320,16035,Clearwater,Idaho,"Essentia Health - Duluth, MN"
1,1,2,3,3,3,3,0,Saint Luke's Medical Center,351325,38023,Divide,North Dakota,"Not In Any System - ,"
1,1,2,3,3,3,3,0,McLeod Health Cheraw,420107,45025,Chesterfield,South Carolina,"McLeod Health - Florence, SC"
1,1,2,3,3,3,3,0,Holzer Medical Center - Jackson,361320,39079,Jackson,Ohio,"Holzer Health Systems - Gallipolis, OH"
1,1,2,3,3,3,3,0,Drew Memorial Hospital,40051,5043,Drew,Arkansas,"Not In Any System - ,"
1,1,2,3,3,3,3,0,Munson Healthcare Grayling Hospital,230058,26039,Crawford,Michigan,"Munson Healthcare - Traverse City, MI"
1,1,2,3,3,3,3,0,Goodall-Witcher Hospital,451385,48035,Bosque,Texas,"Not In Any System - ,"
1,1,2,3,3,3,3,0,Garrett Regional Medical Center,210017,24023,Garrett,Maryland,"West Virginia University Medicine - Morgantown, WV"
1,1,2,3,3,3,3,0,Franklin County Memorial Hospital,281311,31061,Franklin,Nebraska,"Not In Any System - ,"
1,1,2,3,3,3,3,0,Dickenson Community Hospital,491303,51051,Dickenson,Virginia,"Ballad Health - Johnson City, TN"
1,1,2,3,3,3,3,0,Cabinet Peaks Medical Center,271320,30053,Lincoln,Montana,"Not In Any System - ,"
1,1,2,3,3,3,3,0,Piggott Community Hospital,41330,5021,Clay,Arkansas,"Not In Any System - ,"
1,1,2,3,3,3,3,0,Dyersburg Hospital,440072,47045,Dyer,Tennessee,"West Tennessee Healthcare - Jackson, TN"
1,1,2,3,3,3,3,0,Pocahontas Community Hospital,161305,19151,Pocahontas,Iowa,"Not In Any System - ,"
1,1,2,3,3,3,3,0,DeKalb Regional Medical Center,10012,1049,DeKalb,Alabama,"Quorum Health Corporation - Brentwood, TN"
1,1,2,3,3,3,3,0,University of Maryland Shore Medical Center at Easton,210037,24041,Talbot,Maryland,"University of Maryland Medical System - Baltimore, MD"
1,1,2,3,3,3,3,0,Wallowa Memorial Hospital,381306,41063,Wallowa,Oregon,"Not In Any System - ,"
1,1,2,3,3,3,3,0,Wiregrass Medical Center,10062,1061,Geneva,Alabama,"Not In Any System - ,"
1,1,2,3,3,3,3,0,Mitchell County Hospital,451342,48335,Mitchell,Texas,"Not In Any System - ,"
1,1,2,3,3,3,3,0,Bacon County Hospital,111327,13005,Bacon,Georgia,"Not In Any System - ,"
1,1,2,3,3,3,3,0,Cordell Memorial Hospital,371325,40149,Washita,Oklahoma,"Not In Any System - ,"
1,1,2,3,3,3,3,0,Optim Medical Center Tattnall,111323,13267,Tattnall,Georgia,"Not In Any System - ,"
1,1,2,3,3,3,3,0,Garfield County Hospital District,501301,53023,Garfield,Washington,"Not In Any System - ,"
1,1,2,3,3,3,3,0,Prairie Community Hospital District,271309,30079,Prairie,Montana,"Not In Any System - ,"
