Severity 1-day,Severity 2-day,Severity 3-day,Severity 4-day,Severity 5-day,Severity 6-day,Severity 7-day,Total Deaths Hospital,Hospital Name,CMS Certification Number,countyFIPS,CountyName,StateName,System Affiliation
2,2,3,3,3,3,3,0.88,The University of Texas Medical Branch Galveston Campus,450018,48167,Galveston,Texas,"University of Texas System - Dallas, TX"
2,2,2,2,2,2,2,0.88,Redlands Community Hospital,50272,6071,San Bernardino,California,"Not In Any System - ,"
2,2,3,3,3,3,3,0.88,Monument Health Rapid City Hospital,430077,46103,Pennington,South Dakota,"Monument Health - Rapid City, SD"
2,2,2,2,2,2,2,0.88,Lourdes Counseling Center,504008,53005,Benton,Washington,"LifeBridge Health - Baltimore, MD"
2,2,3,3,3,3,3,0.88,Good Samaritan Hospital,360134,39061,Hamilton,Ohio,"TriHealth - Cincinnati, OH"
2,2,3,2,2,2,2,0.88, UPMC Lititz,390068,42071,Lancaster,Pennsylvania,"University of Pittsburgh Medical Center (UPMC) - Pittsburgh, PA"
2,2,3,3,3,3,3,0.88,Fisher-Titus Medical Center,360065,39077,Huron,Ohio,"Not In Any System - ,"
2,2,3,3,3,3,3,0.87,Russell Medical Center,10065,1123,Tallapoosa,Alabama,"Not In Any System - ,"
2,2,3,2,2,2,2,0.87,West Hills Hospital & Medical Center,50481,6037,Los Angeles,California,"HCA Healthcare - Nashville, TN"
2,2,3,3,3,3,3,0.87,SSM Health St. Anthony Hospital-Shawnee,370149,40125,Pottawatomie,Oklahoma,"SSM Health Care - Saint Louis, MO"
2,2,3,2,2,2,2,0.87,Candler Hospital,110024,13051,Chatham,Georgia,"Saint Joseph's/Candler - Savannah, GA"
1,2,2,2,2,2,2,0.87,McKee Medical Center,60030,8069,Larimer,Colorado,"Banner Health - Phoenix, AZ"
1,2,2,2,2,2,2,0.87,Saint Mary's Regional Medical Center,290009,32031,Washoe,Nevada,"Prime Healthcare Services, Inc. - Ontario, CA"
1,2,2,2,2,2,2,0.87,M Health Fairview Southdale Hospital,240078,27053,Hennepin,Minnesota,"Fairview Health Services - Minneapolis, MN"
2,2,3,2,2,2,2,0.87,Saint David's North Austin Medical Center,450809,48453,Travis,Texas,"HCA Healthcare - Nashville, TN"
1,2,2,2,2,2,2,0.87,Addison Gilbert Hospital,220128,25009,Essex,Massachusetts,"Beth Israel Lahey Health - Boston, MA"
2,2,3,2,2,2,2,0.87,Venice Regional Bayfront Health,100070,12115,Sarasota,Florida,"Community Health Systems, Inc. (CHS) - Franklin, TN"
2,2,3,3,3,3,3,0.86,Bethesda North Hospital,360179,39061,Hamilton,Ohio,"TriHealth - Cincinnati, OH"
1,2,2,2,2,2,2,0.86,Baptist Health Medical Center - Little Rock,40114,5119,Pulaski,Arkansas,"Baptist Health - Little Rock, AR"
2,2,3,2,2,2,2,0.86,Samaritan Lebanon Community Hospital,381323,41043,Linn,Oregon,"Samaritan Health Services - Corvallis, OR"
2,2,3,3,3,3,3,0.86,Mission Hospital - Memorial Campus,340002,37021,Buncombe,North Carolina,"HCA Healthcare - Nashville, TN"
2,2,2,2,2,2,2,0.86,MultiCare Valley Hospital,500119,53063,Spokane,Washington,"MultiCare Health System - Tacoma, WA"
1,2,2,2,2,2,2,0.86,Texas Health Presbyterian Hospital Flower Mound,670068,48121,Denton,Texas,"Not In Any System - ,"
2,2,3,3,3,3,3,0.86,Shasta Regional Medical Center,50764,6089,Shasta,California,"Prime Healthcare Services, Inc. - Ontario, CA"
2,2,3,3,3,3,2,0.86,Onslow Memorial Hospital,340042,37133,Onslow,North Carolina,"Not In Any System - ,"
1,2,2,2,2,2,2,0.86,Tri-City Medical Center,50128,6073,San Diego,California,"Not In Any System - ,"
1,2,2,2,2,2,2,0.85,Kaiser Permanente Westside Medical Center,380103,41067,Washington,Oregon,"Kaiser Permanente - Oakland, CA"
1,2,2,2,2,2,2,0.85,Dignity Health - St. Rose Dominican  Rose de Lima Campus,290012,32003,Clark,Nevada,"CommonSpirit Health - Englewood, CO"
2,2,3,3,3,3,3,0.85,Midland Memorial Hospital,450133,48329,Midland,Texas,"Not In Any System - ,"
1,2,2,2,2,2,2,0.85,Bridgeport Hospital Milford Campus,70019,9009,New Haven,Connecticut,"Yale New Haven Health - New Haven, CT"
2,2,3,2,2,2,2,0.85,Mercy Health-Lorain Hospital,360172,39093,Lorain,Ohio,"Bon Secours Mercy Health - Cincinnati, OH"
1,2,2,2,2,2,2,0.85,Mease Countryside Hospital,100265,12103,Pinellas,Florida,"BayCare Health System - Clearwater, FL"
2,2,3,3,3,3,3,0.85,Adventist Health Saint Helena,50013,6055,Napa,California,"Adventist Health - Roseville, CA"
2,2,3,3,3,3,3,0.84,Huntsville Hospital,10039,1089,Madison,Alabama,"Huntsville Healthcare System - Huntsville, AL"
2,2,3,3,3,3,3,0.84,Saint Alphonsus Medical Center - Nampa,130013,16027,Canyon,Idaho,"Trinity Health - Livonia, MI"
2,2,3,3,3,3,3,0.84,Baptist Health Floyd,150044,18043,Floyd,Indiana,"Baptist Health - Louisville, KY"
1,2,2,2,2,2,2,0.84,Primary Children's Hospital,463301,49035,Salt Lake,Utah,"Intermountain Health Care, Inc - Salt Lake City, UT"
1,2,2,2,2,2,2,0.84,OrthoColorado Hospital,60124,8059,Jefferson,Colorado,"Not In Any System - ,"
2,2,3,2,2,2,2,0.84,HSHS Saint John's Hospital,140053,17167,Sangamon,Illinois,"Hospital Sisters Health System (HSHS) - Springfield, IL"
2,2,2,2,2,2,2,0.84,Olympia Medical Center,50742,6037,Los Angeles,California,"Alecto Healthcare - Irvine, CA"
1,2,2,2,2,2,2,0.84,Sharp Chula Vista Medical Center,50222,6073,San Diego,California,"Sharp Healthcare - San Diego, CA"
2,2,3,3,2,2,2,0.84,Hilton Head Hospital,420080,45013,Beaufort,South Carolina,"TENET Healthcare - Dallas, TX"
1,2,2,2,2,2,2,0.83,Provident Hospital of Cook County,140300,17031,Cook,Illinois,"Cook County Health - Chicago, IL"
2,2,2,2,2,2,2,0.83,Cancer Treatment Centers of America Atlanta,110233,13077,Coweta,Georgia,"Cancer Treatment Centers of America - Arlington Heights, IL"
1,2,2,2,2,2,2,0.83,Kindred Hospital Paramount,52046,6037,Los Angeles,California,"Kindred Healthcare - Louisville, KY"
1,2,2,2,2,2,2,0.83,Banner Boswell Medical Center,30061,4013,Maricopa,Arizona,"Banner Health - Phoenix, AZ"
2,2,3,3,3,3,3,0.83,Saline Memorial Hospital,40084,5125,Saline,Arkansas,"Not In Any System - ,"
2,2,3,3,3,3,3,0.83,Mercy Medical Center,50444,6047,Merced,California,"CommonSpirit Health - Englewood, CO"
1,2,2,2,2,2,2,0.83,Banner Estrella Medical Center,30115,4013,Maricopa,Arizona,"Banner Health - Phoenix, AZ"
2,2,3,2,2,2,2,0.83,Memorial Hospital Belleville,140185,17163,St. Clair,Illinois,"Memorial Network - Belleville, IL"
2,2,3,3,3,3,3,0.83,AllianceHealth Ponca City,370006,40071,Kay,Oklahoma,"Community Health Systems, Inc. (CHS) - Franklin, TN"
2,2,3,3,3,3,3,0.83,Memorial Hospital of Carbondale,140164,17077,Jackson,Illinois,"Southern Illinois Healthcare - Carbondale, IL"
1,2,2,2,2,2,2,0.83,Novato Community Hospital,50131,6041,Marin,California,"Sutter Health - Sacramento, CA"
2,2,3,3,3,3,3,0.83,Faith Regional Health Services,280125,31119,Madison,Nebraska,"Not In Any System - ,"
1,2,2,2,2,2,2,0.83,Mayo Clinic Hospital in Florida,100151,12031,Duval,Florida,"Mayo Clinic Health System - Rochester, MN"
1,2,2,2,2,2,2,0.82,Saint Elizabeth's Medical Center,220036,25025,Suffolk,Massachusetts,"Steward Health Care System - Boston, MA"
1,2,2,2,2,2,2,0.82,Select Specialty Hospital - Palm Beach,102023,12099,Palm Beach,Florida,"Select Medical Corporation - Mechanicsburg, PA"
2,2,3,3,3,3,2,0.81, Baylor Scott & White Medical Center Temple,450054,48027,Bell,Texas,"Baylor Scott & White Health - Dallas, TX"
1,2,2,2,2,2,2,0.81,Barnes-Jewish Saint Peters Hospital,260191,29183,St. Charles,Missouri,"BJC HealthCare - Saint Louis, MO"
1,2,2,2,2,2,2,0.81,Select Specialty Hospital - Youngstown,362024,39099,Mahoning,Ohio,"Select Medical Corporation - Mechanicsburg, PA"
1,2,2,2,2,2,2,0.81,Buffalo Psychiatric Center,334052,36029,Erie,New York,"New York State Office of Mental Health - Albany, NY"
2,2,3,3,3,3,3,0.81,Novant Health Huntersville Medical Center,340183,37119,Mecklenburg,North Carolina,"Novant Health - Winston-Salem, NC"
1,1,1,2,2,2,2,0.81,Methodist Dallas Medical Center,450051,48113,Dallas,Texas,"Methodist Health System - Dallas, TX"
2,2,3,3,3,3,3,0.81,Duke University Hospital,340030,37063,Durham,North Carolina,"Duke Health - Durham, NC"
2,2,3,3,2,2,2,0.8,TriStar StoneCrest Medical Center,440227,47149,Rutherford,Tennessee,"HCA Healthcare - Nashville, TN"
2,2,3,3,3,3,3,0.8,MaineGeneral Health,200039,23011,Kennebec,Maine,"Not In Any System - ,"
1,2,2,2,2,2,2,0.8,Oaklawn,154031,18039,Elkhart,Indiana,"Not In Any System - ,"
2,2,3,3,2,2,2,0.8,AMITA Health St. Marys Hospital Kankakee,140155,17091,Kankakee,Illinois,"AMITA Health - Chicago, IL"
1,2,2,2,2,2,2,0.8,Beverly Hospital,50350,6037,Los Angeles,California,"Not In Any System - ,"
2,2,3,2,2,2,2,0.8, HCA Houston Healthcare Kingwood,450775,48339,Montgomery,Texas,"HCA Healthcare - Nashville, TN"
2,2,3,3,3,3,3,0.8,Spartanburg Medical Center,420007,45083,Spartanburg,South Carolina,"Spartanburg Regional Healthcare System - Spartanburg, SC"
2,2,3,3,3,3,3,0.8,Providence Saint Peter Hospital,500024,53067,Thurston,Washington,"Providence St. Joseph Health - Renton, WA"
1,2,2,2,2,2,2,0.8,Ascension Saint Vincent Carmel,150157,18057,Hamilton,Indiana,"Ascension Health - Saint Louis, MO"
1,2,2,2,2,2,2,0.8,Island Hospital,500007,53057,Skagit,Washington,"Not In Any System - ,"
1,2,2,2,2,2,2,0.8,Ascension St. Francis Hospital,520078,55079,Milwaukee,Wisconsin,"Ascension Health - Saint Louis, MO"
1,1,2,2,2,2,2,0.8,San Leandro Medical Center,50777,6001,Alameda,California,"Kaiser Permanente - Oakland, CA"
1,2,2,2,2,2,2,0.79,OhioHealth Grant Medical Center,360017,39049,Franklin,Ohio,"OhioHealth - Columbus, OH"
1,1,2,2,2,2,2,0.79,HonorHealth John C. Lincoln Medical Center,30014,4013,Maricopa,Arizona,"HonorHealth - Scotttsdale, AZ"
2,2,3,3,3,3,3,0.79,Novant Health Forsyth Medical Center,340014,37067,Forsyth,North Carolina,"Novant Health - Winston-Salem, NC"
2,2,3,2,2,2,2,0.79,Ascension St. Vincent Kokomo,150010,18067,Howard,Indiana,"Ascension Health - Saint Louis, MO"
1,2,2,2,2,2,2,0.79,Linden Oaks Behavioral Health,144035,17043,DuPage,Illinois,"Edward-Elmhurst Health - Naperville, IL"
2,2,3,3,3,3,2,0.78,Jones Memorial Hospital,330096,36003,Allegany,New York,"The University of Rochester Medical Center - Rochester, NY"
2,2,3,3,3,2,2,0.78,Saint Francis Regional Medical Center,240104,27139,Scott,Minnesota,"Not In Any System - ,"
2,2,3,3,3,2,2,0.78,Ascension Via Christi Hospital in Pittsburg,170006,20037,Crawford,Kansas,"Ascension Health - Saint Louis, MO"
1,2,2,2,2,2,2,0.78,Spaulding Rehabilitation Hospital of the Cape Cod,223032,25001,Barnstable,Massachusetts,"Partners HealthCare System - Boston, MA"
1,2,2,2,2,2,2,0.78,Wenatchee Valley Hospital and Clinics,500148,53007,Chelan,Washington,"Confluence Health - Wenatchee, WA"
1,2,2,2,2,2,2,0.78,Saint Lawrence Rehabilitation Center,313027,34021,Mercer,New Jersey,"Not In Any System - ,"
2,2,3,3,3,3,3,0.78,Uniontown Hospital,390041,42051,Fayette,Pennsylvania,"Not In Any System - ,"
2,2,3,3,3,2,2,0.78,OhioHealth Grady Memorial Hospital,360210,39041,Delaware,Ohio,"OhioHealth - Columbus, OH"
1,2,3,3,3,3,3,0.78,Adventist HealthCare Rehabilitation,213029,24031,Montgomery,Maryland,"Adventist Healthcare - Gaithersburg, MD"
1,2,2,2,2,2,2,0.78,Lakewood Regional Medical Center,50581,6037,Los Angeles,California,"TENET Healthcare - Dallas, TX"
1,2,2,2,2,2,2,0.78,College Medical Center,50776,6037,Los Angeles,California,"College Health Enterprises - Downey, CA"
1,1,2,2,2,2,2,0.78,Stanford Health Care - ValleyCare-Livermore,50283,6001,Alameda,California,"Stanford Health Care - Stanford, CA"
1,1,2,2,2,2,2,0.78,Banner Baywood Medical Center,30088,4013,Maricopa,Arizona,"Banner Health - Phoenix, AZ"
1,1,2,2,2,2,2,0.78,HRI Hospital,224018,25021,Norfolk,Massachusetts,"Universal Health Services, Inc. - King of Prussia, PA"
2,2,3,3,3,3,3,0.78,Ruby Memorial Hospital,510001,54061,Monongalia,West Virginia,"West Virginia University Medicine - Morgantown, WV"
1,1,2,2,2,2,2,0.78,HonorHealth Deer Valley Medical Center,30092,4013,Maricopa,Arizona,"HonorHealth - Scotttsdale, AZ"
1,1,2,2,2,2,2,0.78,Phoenix Indian Medical Center,30078,4013,Maricopa,Arizona,"Indian Health Service - Rockville, MD"
1,2,2,2,2,2,2,0.77,Sauk Prairie Memorial Hospital,520095,55111,Sauk,Wisconsin,"Not In Any System - ,"
2,2,3,3,3,3,3,0.77,AtlantiCare Regional Medical Center -Atlantic City Campus,310064,34001,Atlantic,New Jersey,"Geisinger - Danville, PA"
1,2,2,2,2,2,2,0.77,Saint David's South Austin Medical Center,450713,48453,Travis,Texas,"HCA Healthcare - Nashville, TN"
1,1,2,2,2,2,2,0.77,WellStar North Fulton Regional Hospital,110198,13121,Fulton,Georgia,"WellStar Health System - Marietta, GA"
1,1,2,2,2,2,2,0.77,UMass Memorial Marlborough Hospital,220049,25017,Middlesex,Massachusetts,"UMass Memorial Health Care - Worcester, MA"
2,2,3,3,3,3,3,0.77,Sparrow Clinton Hospital,231326,26037,Clinton,Michigan,"Sparrow Health System - Lansing, MI"
1,2,2,2,2,2,2,0.77,Roseland Community Hospital,140068,17031,Cook,Illinois,"Not In Any System - ,"
1,2,2,2,2,2,2,0.77,Virtua Our Lady of Lourdes Hospital,310029,34007,Camden,New Jersey,"Virtua Health - Marlton, NJ"
2,2,3,3,3,3,3,0.76,North Sunflower Medical Center,251318,28133,Sunflower,Mississippi,"Not In Any System - ,"
1,2,2,2,2,2,2,0.76,Providence Little Company of Mary Medical Center San Pedro,50078,6037,Los Angeles,California,"Providence St. Joseph Health - Renton, WA"
1,1,1,2,2,2,2,0.76,Women & Infants Hospital,410010,44007,Providence,Rhode Island,"Care New England Health System - Providence, RI"
1,2,2,2,2,2,2,0.76,Mid Coast Hospital,200021,23005,Cumberland,Maine,"Not In Any System - ,"
1,2,2,2,2,2,2,0.76,Ascension Seton Medical Center Austin,450056,48453,Travis,Texas,"Ascension Health - Saint Louis, MO"
1,2,2,2,2,2,2,0.76,Methodist Hospital of Sacramento,50590,6067,Sacramento,California,"CommonSpirit Health - Englewood, CO"
2,2,3,3,3,3,3,0.76, Northwestern Medicine Kishwaukee Hospital,140286,17037,DeKalb,Illinois,"Northwestern Medicine - Chicago, IL"
1,2,2,2,2,2,2,0.76,Mission Community Hospital,50704,6037,Los Angeles,California,"Not In Any System - ,"
1,1,2,2,2,2,2,0.76,Dameron Hospital,50122,6077,San Joaquin,California,"Not In Any System - ,"
1,2,2,2,2,2,2,0.76,CHRISTUS Santa Rosa Hospital - Medical Center,450237,48029,Bexar,Texas,"CHRISTUS Health - Irving, TX"
1,1,2,2,2,2,2,0.75,Kaiser Permanente San Francisco Medical Center,50076,6075,San Francisco,California,"Kaiser Permanente - Oakland, CA"
1,2,2,2,2,2,2,0.75,Physicians Regional - Pine Ridge,100286,12021,Collier,Florida,"Community Health Systems, Inc. (CHS) - Franklin, TN"
1,1,2,2,2,2,2,0.75,Banner Del E. Webb Medical Center,30093,4013,Maricopa,Arizona,"Banner Health - Phoenix, AZ"
1,2,2,2,2,2,2,0.75,Saint Mary Medical Center,150034,18089,Lake,Indiana,"Community Healthcare System - Munster, IN"
1,2,2,2,2,2,2,0.75,Northern Light Mercy Hospital,200008,23005,Cumberland,Maine,"Northern Light Health - Brewer, ME"
1,2,2,2,2,2,2,0.75,Reedsburg Area Medical Center,521351,55111,Sauk,Wisconsin,"Not In Any System - ,"
2,2,3,3,3,2,2,0.75,Nacogdoches Medical Center,450656,48347,Nacogdoches,Texas,"TENET Healthcare - Dallas, TX"
2,2,3,3,3,3,3,0.75,Medical Center Navicent Health,110107,13021,Bibb,Georgia,"Navicent Health - Macon, GA"
1,2,3,3,2,2,2,0.74,Baylor Scott & White Medical Center Round Rock,670034,48491,Williamson,Texas,"Baylor Scott & White Health - Dallas, TX"
1,1,2,2,2,2,2,0.74,Eden Medical Center,50488,6001,Alameda,California,"Sutter Health - Sacramento, CA"
1,2,2,2,2,2,2,0.74,Whittier Hospital Medical Center,50735,6037,Los Angeles,California,"AHMC Healthcare, Inc. - Alhambra, CA"
1,2,2,2,2,2,2,0.74,Surgeons Choice Medical Center,230301,26125,Oakland,Michigan,"Not In Any System - ,"
1,2,2,2,2,2,2,0.74,South Shore Hospital,140181,17031,Cook,Illinois,"Not In Any System - ,"
1,2,2,2,2,2,2,0.74,Bayfront Health Seven Rivers,100249,12017,Citrus,Florida,"Community Health Systems, Inc. (CHS) - Franklin, TN"
1,1,2,2,2,2,2,0.74,Memorial Hospital,100179,12031,Duval,Florida,"HCA Healthcare - Nashville, TN"
1,1,2,2,2,2,2,0.74,Chandler Regional Medical Center,30036,4013,Maricopa,Arizona,"CommonSpirit Health - Englewood, CO"
2,2,3,3,3,3,3,0.74," Genesis Medical Center, East Rusholme Street",160033,19163,Scott,Iowa,"Genesis Health System - Davenport, IA"
2,2,3,3,3,3,3,0.73,Golden Valley Memorial Hospital,260175,29083,Henry,Missouri,"Not In Any System - ,"
1,2,2,2,2,2,2,0.73,Santa Rosa Medical Center,100124,12113,Santa Rosa,Florida,"Community Health Systems, Inc. (CHS) - Franklin, TN"
2,2,3,3,3,2,2,0.73,Baptist Memorial Hospital - DeSoto,250141,28033,DeSoto,Mississippi,"Baptist Memorial Health Care Corporation - Memphis, TN"
1,2,2,2,2,2,2,0.73,Saint Joseph's Hospital,110043,13051,Chatham,Georgia,"Saint Joseph's/Candler - Savannah, GA"
2,2,3,3,2,2,2,0.73,Valley View Hospital,60075,8045,Garfield,Colorado,"Not In Any System - ,"
1,2,2,2,2,2,2,0.73,CHRISTUS Southeast Texas - Saint Elizabeth,450034,48245,Jefferson,Texas,"CHRISTUS Health - Irving, TX"
1,2,2,2,2,2,2,0.73,Hampton Hospital,314021,34005,Burlington,New Jersey,"Universal Health Services, Inc. - King of Prussia, PA"
1,2,2,2,2,2,2,0.72,Miami Valley Hospital,360051,39113,Montgomery,Ohio,"Premier Health Partners - Dayton, OH"
2,2,3,3,3,2,2,0.72,McKay-Dee Hospital,460004,49057,Weber,Utah,"Intermountain Health Care, Inc - Salt Lake City, UT"
1,1,2,2,2,2,2,0.72,Moffitt Cancer Center,100271,12057,Hillsborough,Florida,"Not In Any System - ,"
1,2,2,2,2,2,2,0.72,USC Verdugo Hills Hospital,50124,6037,Los Angeles,California,"Keck Medicine of USC - Los Angeles, CA"
1,1,1,2,2,2,2,0.71,Baylor Scott & White Medical Center Carrollton,450730,48121,Denton,Texas,"Not In Any System - ,"
2,2,3,3,2,2,2,0.71,Highpoint Health,150086,18029,Dearborn,Indiana,"Not In Any System - ,"
1,2,2,2,2,2,2,0.71,Clarks Summit State Hospital,394012,42069,Lackawanna,Pennsylvania,"Pennsylvania Department of Public Welfare - Harrisburg, PA"
1,2,3,3,3,3,3,0.71,Froedtert Menomonee Falls Hospital,520103,55133,Waukesha,Wisconsin,"Froedtert and Medical College of Wisconsin - Milwaukee, WI"
2,2,3,3,2,2,2,0.71,Sparrow Hospital,230230,26065,Ingham,Michigan,"Sparrow Health System - Lansing, MI"
2,2,3,3,2,2,2,0.71,Pana Community Hospital,141341,17021,Christian,Illinois,"Not In Any System - ,"
2,2,3,3,3,3,3,0.71,Hendrick Medical Center,450229,48441,Taylor,Texas,"Not In Any System - ,"
1,1,2,2,2,2,2,0.71,"Bayhealth Hospital, Sussex Campus",80009,10005,Sussex,Delaware,"Bayhealth Medical Center - Dover, DE"
1,1,2,2,2,2,2,0.71,Los Angeles Community Hospital,50663,6037,Los Angeles,California,"Prospect Medical Holdings - Los Angeles, CA"
1,2,2,2,2,2,2,0.71,Community Hospital of the Monterey Peninsula,50145,6053,Monterey,California,"Not In Any System - ,"
1,2,2,2,2,2,2,0.71,Chicago Lakeshore Hospital,144005,17031,Cook,Illinois,"Signature Healthcare Services, LLC - Glendale, AZ"
1,1,2,2,2,2,2,0.7,Hillside Rehabilitation Hospital,363026,39155,Trumbull,Ohio,"Steward Health Care System - Boston, MA"
1,2,2,2,2,2,2,0.7,Paoli Hospital,390153,42029,Chester,Pennsylvania,"Main Line Health - Paoli, PA"
1,1,2,2,2,2,2,0.7,LA Downtown Medical Center Downtown Campus,50763,6037,Los Angeles,California,"Not In Any System - ,"
1,2,2,2,2,2,2,0.7,Baptist Hospitals of Southeast Texas,450346,48245,Jefferson,Texas,"Not In Any System - ,"
1,2,2,2,2,2,3,0.7,Spring Grove Hospital Center,214018,24005,Baltimore,Maryland,"Maryland Department of Health - Baltimore, MD"
1,2,2,2,2,2,2,0.7,Springhill Medical Center,10144,1097,Mobile,Alabama,"Not In Any System - ,"
1,2,3,2,2,2,2,0.69,Eaton Rapids Medical Center,231324,26045,Eaton,Michigan,"Not In Any System - ,"
1,2,3,2,2,2,2,0.69,Sanford Medical Center Fargo,350011,38017,Cass,North Dakota,"Sanford Health - Fargo, Sioux Falls, ND"
1,1,2,2,2,2,2,0.69,Southern California Hospital at Culver City,50752,6037,Los Angeles,California,"Prospect Medical Holdings - Los Angeles, CA"
1,2,2,2,2,2,2,0.69,USA Chldren's and Women's Hospital,13301,1097,Mobile,Alabama,"University of South Alabama Health System - Mobile, AL"
2,2,3,3,3,3,3,0.69,Froedtert Kenosha Hospital,520021,55059,Kenosha,Wisconsin,"Froedtert and Medical College of Wisconsin - Milwaukee, WI"
1,2,3,2,2,2,2,0.69,University of Missouri Hospital,260141,29019,Boone,Missouri,"University of Missouri Health System - Columbia, MO"
1,1,1,2,2,2,2,0.69,Northern Colorado Long Term Acute Hospital,62017,8123,Weld,Colorado,"Ernest Health, Inc. - Albuquerque, NM"
2,2,3,3,3,2,2,0.68,Central Florida Regional Hospital,100161,12117,Seminole,Florida,"HCA Healthcare - Nashville, TN"
1,2,3,3,3,3,3,0.68,North Mississippi Medical Center Gilmore - Amory,250025,28095,Monroe,Mississippi,"North Mississippi Health Services - Tupelo, MS"
1,1,2,2,2,2,2,0.68,Fox Chase Cancer Center,390196,42101,Philadelphia,Pennsylvania,"Temple University Health System - Philadelphia, PA"
1,1,1,2,2,2,2,0.68,New England Sinai Hospital,222027,25021,Norfolk,Massachusetts,"Steward Health Care System - Boston, MA"
1,2,3,3,2,2,2,0.68,Mariners Hospital,101313,12087,Monroe,Florida,"Baptist Health South Florida - Coral Gables, FL"
1,1,2,2,2,2,2,0.68,Abington - Lansdale Hospital,390012,42091,Montgomery,Pennsylvania,"Jefferson Health - Philadelphia, PA"
1,2,3,3,3,3,3,0.68,Adventist HealthCare Shady Grove Medical Center - Mental Health,214013,24031,Montgomery,Maryland,"Adventist Healthcare - Gaithersburg, MD"
1,1,2,2,2,2,2,0.68,CHI St. Joseph Health College Station Hospital,450299,48041,Brazos,Texas,"CommonSpirit Health - Englewood, CO"
1,1,1,2,2,2,2,0.67,Sutter Tracy Community Hospital,50313,6077,San Joaquin,California,"Sutter Health - Sacramento, CA"
1,2,3,2,2,2,2,0.67,Lake Huron Medical Center,230031,26147,St. Clair,Michigan,"Prime Healthcare Services, Inc. - Ontario, CA"
1,1,2,2,2,2,2,0.67,Saint Francis Hospital-Memphis,440183,47157,Shelby,Tennessee,"TENET Healthcare - Dallas, TX"
1,2,3,2,2,2,2,0.67,MVHS - St. Elizabeth Campus,330245,36065,Oneida,New York,"Mohawk Valley Health System - New Hartford, NY"
1,1,2,2,2,2,2,0.67,Fairview Hospital,360077,39035,Cuyahoga,Ohio,"Cleveland Clinic Health System - Cleveland, OH"
1,1,2,2,2,2,2,0.67,Salinas Valley Memorial Hospital,50334,6053,Monterey,California,"Not In Any System - ,"
1,2,3,2,2,2,2,0.67,Conway Regional Medical Center,40029,5045,Faulkner,Arkansas,"Conway Regional Health System - Conway, AR"
1,2,2,2,2,2,2,0.67,Wake Forest Baptist Health -High Point Medical Center,340004,37081,Guilford,North Carolina,"Wake Forest Baptist Health - Winston-Salem, NC"
1,1,2,2,2,2,2,0.67,Alliance Community Hospital,360131,39151,Stark,Ohio,"Not In Any System - ,"
1,1,2,2,2,2,2,0.67,Nanticoke Memorial Hospital,80006,10005,Sussex,Delaware,"Not In Any System - ,"
2,2,3,3,3,3,3,0.67,Rush Foundation Hospital,250069,28075,Lauderdale,Mississippi,"Rush Health Systems - Meridian, MS"
1,2,3,3,3,3,3,0.67,Marian Regional Medical Center,50107,6083,Santa Barbara,California,"CommonSpirit Health - Englewood, CO"
1,1,2,2,2,2,2,0.66,Children's Mercy Hospital Kansas,173300,20091,Johnson,Kansas,"Children's Mercy Hospital & Clinics - Kansas City, MO"
1,2,3,3,2,2,2,0.66,Beloit Memorial Hospital,520100,55105,Rock,Wisconsin,"Not In Any System - ,"
2,2,3,3,3,3,3,0.66,OSF Saint Francis Medical Center,140067,17143,Peoria,Illinois,"OSF Healthcare System - Peoria, IL"
1,1,1,2,2,2,2,0.66,Mercy Gilbert Medical Center,30119,4013,Maricopa,Arizona,"CommonSpirit Health - Englewood, CO"
1,2,3,3,2,2,2,0.66,SMHC Medical Center - Biddeford,200019,23031,York,Maine,"MaineHealth - Portland, ME"
1,1,1,2,2,2,2,0.66,Community Hospital of San Bernardino,50089,6071,San Bernardino,California,"CommonSpirit Health - Englewood, CO"
1,1,2,2,2,2,2,0.66,Alhambra Hospital Medical Center,50281,6037,Los Angeles,California,"Not In Any System - ,"
1,1,2,2,2,2,2,0.66,United Hospital,240038,27123,Ramsey,Minnesota,"Allina Health - Minneapolis, MN"
1,1,2,2,2,2,2,0.65,Saint Luke's Rehabilitation Institute,503025,53063,Spokane,Washington,"Providence St. Joseph Health - Renton, WA"
1,1,2,2,2,2,2,0.65,Saint Cloud Regional Medical Center,100302,12097,Osceola,Florida,"Not In Any System - ,"
1,1,1,2,2,2,2,0.65,St. Clare Hospital,500021,53053,Pierce,Washington,"CommonSpirit Health - Englewood, CO"
1,2,3,3,3,3,3,0.65,Hopi Health Care Center,31305,4017,Navajo,Arizona,"Indian Health Service - Rockville, MD"
1,1,1,2,2,2,2,0.65,Abrazo Arrowhead Hospital,30094,4013,Maricopa,Arizona,"TENET Healthcare - Dallas, TX"
1,2,3,2,2,2,2,0.65,IU Health Ball Memorial Hospital,150089,18035,Delaware,Indiana,"Indiana University Health - Indianapolis, IN"
1,1,2,2,2,2,2,0.65,Summa Health System-Barberton Campus,360019,39153,Summit,Ohio,"Summa Health System - Akron, OH"
1,1,2,2,2,2,2,0.65,Weiss Memorial Hospital,140082,17031,Cook,Illinois,"Pipeline Health - El Segundo, CA"
1,2,3,2,2,2,2,0.64,Aurora Sheboygan Memorial Medical Center,520035,55117,Sheboygan,Wisconsin,"Advocate Aurora Health - Downers Grove, IL"
1,1,1,2,2,2,2,0.64,Kindred Hospital The Palm Beaches,102025,12099,Palm Beach,Florida,"Kindred Healthcare - Louisville, KY"
1,1,1,2,2,2,2,0.64,Legacy Meridian Park Hospital,380089,41005,Clackamas,Oregon,"Legacy Health System - Portland, OR"
1,1,2,2,2,2,2,0.64,College Hospital Cerritos,54055,6037,Los Angeles,California,"College Health Enterprises - Downey, CA"
1,1,2,2,2,2,2,0.64,Kindred Hospital - La Mirada,52038,6037,Los Angeles,California,"Kindred Healthcare - Louisville, KY"
1,1,2,2,2,2,2,0.64,Metro Health Hospital,230236,26081,Kent,Michigan,"Not In Any System - ,"
1,1,2,2,2,2,2,0.64,Morton Hospital,220073,25005,Bristol,Massachusetts,"Steward Health Care System - Boston, MA"
1,1,1,2,2,2,2,0.64,Menorah Medical Center,170182,20091,Johnson,Kansas,"HCA Healthcare - Nashville, TN"
1,2,3,3,3,3,3,0.63,West Chester Medical Center,360354,39017,Butler,Ohio,"UC Health - Cincinnati, OH"
1,1,1,2,2,2,2,0.63,Whittier Rehabilitation Hospital - Bradford,222047,25009,Essex,Massachusetts,"Whittier Health Network - Westborough, MA"
1,2,2,2,2,2,2,0.63,Novant Health Presbyterian Medical Center,340053,37119,Mecklenburg,North Carolina,"Novant Health - Winston-Salem, NC"
1,1,2,2,2,2,2,0.63,Marina Del Rey Hospital,50740,6037,Los Angeles,California,"Cedars Sinai Health System - Los Angeles, CA"
1,1,2,2,2,2,2,0.63,Select Specialty Hospital - Grosse Pointe,232038,26163,Wayne,Michigan,"Select Medical Corporation - Mechanicsburg, PA"
1,1,2,2,2,2,2,0.63,Hartgrove Behavioral Health System,144026,17031,Cook,Illinois,"Universal Health Services, Inc. - King of Prussia, PA"
